{
  "$changeflowBenchmark": "0.1",
  "recipe": "node --expose-gc benchmark/changeflow.js",
  "measuredAt": "2026-10-08T11:29:18.670Z",
  "runtime": "v24.20.0",
  "host": {
    "platform": "linux",
    "cpu": "AMD Ryzen 9 5900HX with Radeon Graphics"
  },
  "samples": 15,
  "correctness": "Every mutation checked against fresh SQL and a patch-only consumer; every replication delivery checked against complete state.",
  "memory": {
    "rssBytes": 201080832
  },
  "live": [
    {
      "shape": "selective join",
      "mode": "incremental",
      "strategy": {
        "strategy": "join",
        "mode": "incremental"
      },
      "rows": 200,
      "fanout": 1,
      "initializationMs": 17.093457,
      "retainedHeapBytes": 5794368,
      "mutationMs": {
        "p50": 0.37472700000000714,
        "p95": 2.182617999999991,
        "max": 2.182617999999991
      },
      "oracleMs": {
        "p50": 0.5666530000000023,
        "p95": 0.6537959999999998,
        "max": 0.6537959999999998
      },
      "stats": {
        "records": 15,
        "matched": 15,
        "emissions": 15,
        "dependencyReads": 15,
        "refreshedRoots": 215,
        "reruns": 0
      }
    },
    {
      "shape": "selective join",
      "mode": "rerun",
      "strategy": {
        "strategy": "rerun",
        "mode": "rerun",
        "reason": "re-run mode was explicitly requested"
      },
      "rows": 200,
      "fanout": 1,
      "initializationMs": 0.9971030000000098,
      "retainedHeapBytes": 403920,
      "mutationMs": {
        "p50": 0.8842840000000081,
        "p95": 1.3129810000000077,
        "max": 1.3129810000000077
      },
      "oracleMs": {
        "p50": 0.4633609999999919,
        "p95": 0.5076729999999827,
        "max": 0.5076729999999827
      },
      "stats": {
        "records": 15,
        "matched": 15,
        "emissions": 15,
        "reruns": 15
      }
    },
    {
      "shape": "high fan-out join",
      "mode": "incremental",
      "strategy": {
        "strategy": "join",
        "mode": "incremental"
      },
      "rows": 200,
      "fanout": 200,
      "initializationMs": 7.930633,
      "retainedHeapBytes": 5713120,
      "mutationMs": {
        "p50": 1.940025999999989,
        "p95": 3.187164999999993,
        "max": 3.187164999999993
      },
      "oracleMs": {
        "p50": 0.41540300000002617,
        "p95": 0.5164399999999887,
        "max": 0.5164399999999887
      },
      "stats": {
        "records": 15,
        "matched": 15,
        "emissions": 15,
        "dependencyReads": 15,
        "refreshedRoots": 3200,
        "reruns": 0
      }
    },
    {
      "shape": "high fan-out join",
      "mode": "rerun",
      "strategy": {
        "strategy": "rerun",
        "mode": "rerun",
        "reason": "re-run mode was explicitly requested"
      },
      "rows": 200,
      "fanout": 200,
      "initializationMs": 0.797663,
      "retainedHeapBytes": 389800,
      "mutationMs": {
        "p50": 0.9083590000000186,
        "p95": 1.2200280000000134,
        "max": 1.2200280000000134
      },
      "oracleMs": {
        "p50": 0.3186019999999985,
        "p95": 0.40844000000004144,
        "max": 0.40844000000004144
      },
      "stats": {
        "records": 15,
        "matched": 15,
        "emissions": 15,
        "reruns": 15
      }
    },
    {
      "shape": "graph",
      "mode": "incremental",
      "strategy": {
        "strategy": "graph",
        "mode": "incremental"
      },
      "rows": 200,
      "fanout": 1,
      "initializationMs": 7.962863000000027,
      "retainedHeapBytes": 5668352,
      "mutationMs": {
        "p50": 0.2586600000000203,
        "p95": 0.534624000000008,
        "max": 0.534624000000008
      },
      "oracleMs": {
        "p50": 3.6750519999999938,
        "p95": 5.164159999999981,
        "max": 5.164159999999981
      },
      "stats": {
        "records": 15,
        "matched": 15,
        "emissions": 15,
        "dependencyReads": 15,
        "refreshedRoots": 215,
        "reruns": 0
      }
    },
    {
      "shape": "graph",
      "mode": "rerun",
      "strategy": {
        "strategy": "rerun",
        "mode": "rerun",
        "reason": "re-run mode was explicitly requested"
      },
      "rows": 200,
      "fanout": 1,
      "initializationMs": 4.350006000000008,
      "retainedHeapBytes": 1487568,
      "mutationMs": {
        "p50": 4.257144000000039,
        "p95": 4.802347000000054,
        "max": 4.802347000000054
      },
      "oracleMs": {
        "p50": 3.5780110000000604,
        "p95": 3.8097629999999754,
        "max": 3.8097629999999754
      },
      "stats": {
        "records": 15,
        "matched": 15,
        "emissions": 15,
        "reruns": 15
      }
    },
    {
      "shape": "self join",
      "mode": "incremental",
      "strategy": {
        "strategy": "join",
        "mode": "incremental"
      },
      "rows": 200,
      "fanout": 1,
      "initializationMs": 5.303249000000051,
      "retainedHeapBytes": 4126448,
      "mutationMs": {
        "p50": 0.2392050000000836,
        "p95": 0.4006049999999277,
        "max": 0.4006049999999277
      },
      "oracleMs": {
        "p50": 0.5075740000000906,
        "p95": 0.5412759999999253,
        "max": 0.5412759999999253
      },
      "stats": {
        "records": 15,
        "matched": 15,
        "emissions": 15,
        "dependencyReads": 15,
        "refreshedRoots": 215,
        "reruns": 0
      }
    },
    {
      "shape": "self join",
      "mode": "rerun",
      "strategy": {
        "strategy": "rerun",
        "mode": "rerun",
        "reason": "re-run mode was explicitly requested"
      },
      "rows": 200,
      "fanout": 1,
      "initializationMs": 0.8273380000000543,
      "retainedHeapBytes": 450296,
      "mutationMs": {
        "p50": 0.9121049999999968,
        "p95": 1.1303010000000313,
        "max": 1.1303010000000313
      },
      "oracleMs": {
        "p50": 0.4908029999999144,
        "p95": 0.5177330000000211,
        "max": 0.5177330000000211
      },
      "stats": {
        "records": 15,
        "matched": 15,
        "emissions": 15,
        "reruns": 15
      }
    },
    {
      "shape": "multiple-key groups",
      "mode": "incremental",
      "strategy": {
        "strategy": "group",
        "mode": "incremental"
      },
      "rows": 200,
      "fanout": 10,
      "initializationMs": 8.162172999999939,
      "retainedHeapBytes": 2358736,
      "mutationMs": {
        "p50": 0.2654929999999922,
        "p95": 0.8682840000000169,
        "max": 0.8682840000000169
      },
      "oracleMs": {
        "p50": 0.40706599999998616,
        "p95": 0.5064409999999953,
        "max": 0.5064409999999953
      },
      "stats": {
        "records": 15,
        "matched": 15,
        "emissions": 15,
        "refreshedGroups": 36,
        "dependencyReads": 15,
        "reruns": 0
      }
    },
    {
      "shape": "multiple-key groups",
      "mode": "rerun",
      "strategy": {
        "strategy": "rerun",
        "mode": "rerun",
        "reason": "rerun was requested"
      },
      "rows": 200,
      "fanout": 10,
      "initializationMs": 0.8564920000000029,
      "retainedHeapBytes": 279616,
      "mutationMs": {
        "p50": 0.5610329999999522,
        "p95": 0.6871779999999035,
        "max": 0.6871779999999035
      },
      "oracleMs": {
        "p50": 0.3781129999999848,
        "p95": 0.4776679999999942,
        "max": 0.4776679999999942
      },
      "stats": {
        "records": 15,
        "matched": 15,
        "emissions": 15,
        "reruns": 15
      }
    },
    {
      "shape": "group aggregate",
      "mode": "incremental",
      "strategy": {
        "strategy": "group",
        "mode": "incremental"
      },
      "rows": 200,
      "fanout": 10,
      "initializationMs": 3.8539839999999685,
      "retainedHeapBytes": 2062776,
      "mutationMs": {
        "p50": 0.2435729999999694,
        "p95": 0.48245699999995395,
        "max": 0.48245699999995395
      },
      "oracleMs": {
        "p50": 0.36181299999998373,
        "p95": 0.4219339999999647,
        "max": 0.4219339999999647
      },
      "stats": {
        "records": 15,
        "matched": 15,
        "emissions": 15,
        "refreshedGroups": 36,
        "dependencyReads": 15,
        "reruns": 0
      }
    },
    {
      "shape": "group aggregate",
      "mode": "rerun",
      "strategy": {
        "strategy": "rerun",
        "mode": "rerun",
        "reason": "rerun was requested"
      },
      "rows": 200,
      "fanout": 10,
      "initializationMs": 0.8147950000000037,
      "retainedHeapBytes": 267800,
      "mutationMs": {
        "p50": 0.44881499999996777,
        "p95": 0.5321190000000797,
        "max": 0.5321190000000797
      },
      "oracleMs": {
        "p50": 0.3471550000000434,
        "p95": 0.41386899999997695,
        "max": 0.41386899999997695
      },
      "stats": {
        "records": 15,
        "matched": 15,
        "emissions": 15,
        "reruns": 15
      }
    },
    {
      "shape": "distinct",
      "mode": "incremental",
      "strategy": {
        "strategy": "distinct",
        "mode": "incremental"
      },
      "rows": 200,
      "fanout": 10,
      "initializationMs": 3.8443569999999454,
      "retainedHeapBytes": 1778488,
      "mutationMs": {
        "p50": 0.19782800000007228,
        "p95": 0.32259899999996833,
        "max": 0.32259899999996833
      },
      "oracleMs": {
        "p50": 0.15782400000000507,
        "p95": 0.18719799999996667,
        "max": 0.18719799999996667
      },
      "stats": {
        "records": 15,
        "matched": 15,
        "emissions": 15,
        "refreshedGroups": 21,
        "dependencyReads": 15,
        "reruns": 0
      }
    },
    {
      "shape": "distinct",
      "mode": "rerun",
      "strategy": {
        "strategy": "rerun",
        "mode": "rerun",
        "reason": "rerun was requested"
      },
      "rows": 200,